id,source,rewrite_a,rewrite_b,issue,batch
153,"Based on an assumption that humans are artificial and not part of nature, then if we could create another being capable of being a sentient life form, it would not be equal to us no matter how more intelligent, until it has achieved the same things as us, including creating more sentient lifeforms. If it does achieve those things, then it would have to do so at same rate, otherwise if it was faster it would be greater than us, or if slower than still inferior to us. However this would only be the case of course if we as ""artificial beings"" of God our creator, would be capable of creating another sentient being in the same image and likeness of our creator and not just ourselves. Otherwise it would never be our equal.",,,"If humans are artificial intelligence but have rights, would that mean any sentient being (possibly far more intelligent)  we create is equal to us?   stance: no.:",4
154,"Trapper was a pretender, a goofball who got out while the gettin' was good. While he was back in the States starting his private practice (Trapper John, MD), BJ was with Hawkeye until the end. As the war dragged on, and Hawk was starting to lose it, did Trapper call to see how they were? No, but BJ was delighting his comrades with home films of Peg and Erin, pranking Charles, and taking over surgery while Hawkeye was seeing chickens on buses.",,,Trapper john or bj honeycutt   stance: bj honeycutt was the best sidekick to hawkeye:,5
155,"I think the worst problem can be when debaters spend a significant portion of their time debating about trivial things...such as misspellings. We all do it on occasion...don't we? I could bicker about the member who posted the debate on being illiterate...and rant on about how ridiculous it is to make such a remark...after all, how could posters be illiterate, if they read and write? The person who created the debate obviously doesn't get that...even if it is just an attempt at being sarcastic...but what's the point?",,,Is misspelling words really a huge problem?   stance: disagree:,1
156,"Is marriage really just about ""love?"" I think not. It's about societal norms. It's about legal rights. It's about families. It's about generations. It's about example. It's about commitment. It's about tax breaks. It's about parental roles. If it were just about ""love"" then I could marry my dog and two kids at the local middle-school could get married as well. It's not only about love.",,,Gay marriage right or wrong:,2
157,"If god loves everyone then y does he hate gays and the bible is just a book, have you ever wondered that the one cardinal who translated it changed some things to make ""god"" look good",,,Christianity or atheism:,3
158,Because spanking is mostly out of anger and can be for more then what your kid had done like if some one else made thm mad thy let it all out on thm,,,Human growth and development should parents use spanking as an option to discipline:,4
159,"The minimum length for an argument is 50 characters. The purpose of this restriction is to cut down on the amount of dumb jokes, so we can keep the quality of debate and discourse as high as possible.",,,Should physical education be mandatory in schools:,5
160,"I just don't know if you are referring Latinos as a whole or to an specific group. I know that must people that were born south of the USA, may speak the same way because after all Spanish is their native tongue, so when they move to speak English they may have sort of similar accent. Let me tell you something, not all ""Latinos"" are the same, Puerto Ricans, Cubans, Dominicans are very different to the rest of Latinamerica.  You don't say to an Irish he is British or to a Canadian he is American or to a Basque he is Spanish. Culture shouldn't be an excuse to do something wrong, when you are allowed into another country you should learn their customs and traditions. To say that because of my culture i do this or that, is just a lame excuse to avoid responsibility.",,,"When a latino does anything, the excuse is, it's their culture. how come i can't do that? wht about my culture:",1
161,"well, you see people these days are to busy to see what is going on in the world.  I may not know everything, but from I think people are just to stupid to just watch what Bushy (please do not sue me because i just said ""Bushy"" instead of Bush,I just like the name like that)here is doing. You see, also people are sometimes to poor to buy their own TV set or even a newspaper(or they're just to lazy too) because of taxes,gas prices,and ALL OF THEIR LITTLE STUPID FRIEND!!!!!!!!
And there is my opinion, you may not like what I just wrote, but DEAL WITH IT!",,,Why do people not see that the us president is a criminal?:,2
162,"Recently, I saw a meme about protesters in London pouring concrete over so called ""anti-homeless"" spikes. All of the comments were commending and praising the protesters instead of calling them out on property destruction. More often than not, the goal of a business is to make money, it is not a charity. And seeing homeless people near the entrance is enough to turn a lot of people off that would normally enter their business. So in my opinion, Tesco is just acting in rational self-interest and these protesters are nothing more than common thugs whom should be charged with property destruction and have to pay the costs that they incurred. I see nothing wrong with the spikes if they are doing it to protect their customer base.",,,"Cmv: i have no ethical issue with so called ""anti homeless spikes"":",3
163,"If you have read some of the other reviews you'll see that service is an issue.  Our group of 3 encountered the same experience at lunch on a weekday.  The staff were all young.  I did not see anyone who appeared to be older than 22 years of age.  Perhaps they need someone older with some customer experience??
The food was great.  The bok choy was outstanding.  Just about all of the dishes show on the menu with a little chili pepper symbols.  However, we did not find them to be all that spicy. 
The 3 stars is for the service.  5 stars would be for the food.
We'll return here but allow a little more time to pay the tab since they are slow at cashing out.  So, if you have a certain time available to you for lunch you may not want to dine here.",,,"Business review: 3.0 stars
business name: original cuisine. city: mesa. categories: chinese, szechuan, restaurants:",4
164,School uniforms are a BAD idea. Kids won't be able to show their color.,,,Is the school uniform a good or bad idea:,5
165,All TV shows are written down as scripts (a form of book) first...,,,Tv is better than books:,1
166,"YES, because some children don't understand anything expect physical education especially rich children of rich parents.",,,Should physical education be mandatory in schools:,2
167,"sabrejimmy,
I have not tried to prove ANYTHING. All i asked was for YOU to prove that we are not evolving.
Not once did i say that we are still evolving.
I have not made any such assertions.
So until you can show that we are not evolving with credible evidence, you are just avoiding something you cannot answer.
So i say again, back up YOUR claim that we are not evolving.
And the big bang is a red herring, we are talking about evolution, NOT Cosmology.
It looks like you are trying to steer the debate away from what it is because you cannot back up your claims.",,,Evolution vs creation:,3
168,"The real issue is - why is the government involved in this issue at all? We take a personal, religious institution and regulate it, then the government comes back and wants to redefine it.
It should not be a political issue, because my personal, religious things should be separate from government regulation.
Marriage and the government should not mix. That solves the ""problem"".",,,Gay marriage right or wrong:,4
169,"Gay marriage is wrong. God made man and a woman to populate the earth. How can human species survive if they are only attracted to their same sex? Obviously, not.",,,Gay marriage right or wrong:,5
170,"gays are overrated. it is another ""look at me"" stunt. i think gays are the product of overly protective parents, abuse, or liberal wakoness (it should be a disease).
if you gays would stop calling attention to yourselves, nobody would really care what you do.",,,Gay marriage right or wrong:,1
171,"I'm an avid christian and I believe that gay marriage is wrong beyond belief. This country was founded on christian beliefs, and we should adhere to the belifs used to make us what we are today.",,,Gay marriage right or wrong:,2
172,aah...u r saying like that only india has this things.....other countries donot have this.....does the america which seems as leading the world doesnt have bad qualities.....it eats less and waste more.....the amount of food they waste can be utillised for feeding whole indian population...it produces more pollution and blame us...what about it !!!!!!!,,,India has the potential to lead the world:,3
173,Statistics prove that less than 1% of women who are raped get pregnant because of the adrenalin rush. We have no right to take an unborn child's life. There are ways to avoid the situation of abortion. The woman can have the baby and give it up for adoption or raise it as their own because the woman is the still the child's biological mother. There are thousands of people on the waiting list for another baby to add to their family. DO NOT let anyone tell you otherwise because they obviously havn't been in the situation of adoption or abortion.,,,Pro choice vs pro life:,4
174,"please it is president Clinton, and though people are going to say it is just politics it is the same issue. if it is wrong now it was wrong then.  if anything there has always been a double standard between Democrats and Republicans.  people are screaming about an illegal war can not remember president Clinton asking congress for any wars he got us in. but you have president Bush who did go to congress.",,,Was it legal when clinton spied on americans?:,5
175,"yes and most of them are hypocrites. our DUI judge places people in jail, takes away their freedom, but it's okay for him to sit on the bench drunk. the whole town knows it, the lawyers, the cops, etc. we watched the cops pull him over one night and they gave him a ride home, (we followed), but how can you  fight it?",,,"In the usa, are judges too powerful?:",1
176,"If the judge couldn't hear her clearly then I think he has every right to ask for the person in question to remove her veil.  If the woman who is a lawyer could not be understood in court then she is not doing her job properly due to the presence of her veil and the judge could not do his job properly either.  I can only respect for asking for the veil to be removed, I mean it isn't for very long and she was fighting for someone in court!  

We're in Britain here where the covering your face is seen as suspicious, these women relly need to think about the message the veil puts across about them and their religion.",,,Was the judge right to ask the muslim lawyer to remove her veil yesterday?:,2
177,"Why not?  People complain it is against God.  so those who feel that way should decline wedding invitations from gays.  MAN makes these rules and uses God as an excuse.  There are religions where a man can have many wives; do you  hear anyone complaining?  Anyway marriage does not have to be a religious ceremony.  People get married every day by a Justice of the Peace, a Mayor, even a ship's captain.  atheists get married.  what's the big deal?   so all the people who think this is a sin, would leave the ""sinners"" alone,  after all isn't it their God's job to judge them?  and to ""punish"".  They do believe their God gave them ""free will"" don't they?",,,Your views on same sex marriage...?:,3
178,"I work in downtown LA and the homeless problem here is pretty bad. There was a guy who threw his shits in front of our building this morning. At the food court I go to, homeless guys sometimes walk around and beg for change. They're also begging and sleeping on the LA subways because our subways don't have turnstiles and rely on the honor system. 

They are a nuisance to everyone. Most of them look like they have mental illness. 

I think for any major city to develop faster, it needs to get rid of the homeless problem. 

I think homeless should be rounded up, put into camps, and treated for their mental health or addiction problems. That way major downtown area could be cleaner and safer and the homeless could get the treatment they need. The approach that most cities have of ignoring the problem won't work and it really hurts the local economy.",,,"Cmv: i think all homeless people should be rounded up, taken out of major city centers, and be put in government camps where they can get treatment:",4
179,"I understand the democratic party collects the most money from PACs. I understand as a union guy that our dues are paltry, and the teamsters and other unions supply a comparatively tiny amount of money to politicians as opposed to corporations. There is already so much undue influence by corporations that I think the ability to fund pro-union politicians would be a fine democratic check to the power of capital. When a politician wants to use legislation to curtail my right to assemble and air my grievances it reminds me of state socialist countries that do the same to their autonomous worker organizations.
",,,"Cmv: i believe unions should be able to use pacs and super pacs during election season, but corporations shouldn't.:",5
180,"Horrible valet fees $16 for first 2 hours. Hotel claims
People are using parking for airport bullshit. They cost share with the valet so no need to tip I guess at that cost. Disgusting with all the bad press this place has. The Venetian doesn't charge for Valet. They are so greedy at Mandalay Bay. It's the MGM corporation in general. All their hotels are doing this.

Found out that if you park at the shopping center valet at Mandalay it's free. Sounds silly to rant about this. The casinos just rip everything off. So flood the mall parking.",,,"Business review: 1.0 stars
business name: mandalay bay resort & casino. city: las vegas. categories: resorts, arts & entertainment, restaurants, hotels, hotels & travel, event planning & services, casinos:",1
181,"In comparison to civil dress, school uniforms prove to be futile and wasteful once the child is out of school.",,,Is the school uniform a good or bad idea:,2
182,"1. Books don't ruin your eyes like TV. does.
2. Books allow your brain to imagine rather than doing it for you.
3. Reading books a lot can help you with spelling.
4. Reading books a lot can help you write better.
5. Reading books teaches you to read. Watching TV. doesn't",,,Tv is better than books:,3
183,"India does not have the potential to lead the world because the country is full of corruption, corruption in politicians ,numerous religion, fight between various religions, and a lot more............................",,,India has the potential to lead the world:,4
184,"Whether you are in a venture purely for yourself or others, you still end up affecting the people around you.
When asking someone why they decide to help with the common good, the response would be something along the lines of, ""it feels good to help out.""
Ultimately, people don't help out people unless they get some sort of satisfaction out of it, be it whether they community service hours, material rewards, fame, or just having the satisfaction of knowing that you have importance. So when helping out others, you make others feel good as well as yourself.",,,Which type of endeavor is better a personal pursuit or advancing the common good:,5
185,ever since recorded history weve believed in sky spirits for which no evidence exists at all.,,,Christianity or atheism:,1
186,"there isnt an excuse in the world to kill a fetus, a baby, a child, anyone.
if the woman was raped, it most certainly is Not the baby's fault. the woman with the baby whoever they are should speak For the baby, and know that the baby would want to live.",,,Pro choice vs pro life:,2
187,"What is wrong with it, if they want to marry let them. If were your child or adopted mother/father you'd accept it!!!",,,Gay marriage right or wrong:,3
188,"Because it would be thoroughly unfair to force people to pay for things they can't afford.

Get real.  ""Allow"" connotes freedom, which is all a government should give you.  And that same ""allow"" is what permits anyone to make whatever they want out of themselves, purchase whatever they want.  You'd have a gripe if you could phrase the question ""How can the US FORBID people from buying food or health insurance,"" but you can't.",,,How can the us continue to allow people to go without food & health insurance? how to fix?:,4
189,"Title is fairly self explanatory. The latest front page post of the sticker that says ""Guns don't kill people, people with God kill people"" has led me to write this CMV.

I am not a religious man, so I don't feel this is a biased CMV.

I feel saying ""Gun's don't kill people, People with God kill people"" is equal to a religious person saying ""Guns don't kill people, people *without* God kill people"".

I feel /r/atheism is an extreme side of Atheism, and is as evil as an extreme religious sect. It harbours hatred towards a particular group of people; people who hold a different life view than their own. 

Change my view.",,,"Cmv: i feel /r/atheism is more about embracing hatred towards religion, and less about embracing atheism:",5
190,"Welfare reduces incentives for the lower class to move up because it makes them be content where they are.
Welfare means taxing people more, making them spend less and reducing business growth.
Welfare means being forced to pay for your neighbor's new television.
Welfare means having to pay for some fat ass that didn't know any better than to eat at McDonalds every day.
Welfare is bad!",,,Welfare: best system   stance: no welfare!:,1
191,"By choosing where our taxes go, the government can determine which organizations/groups are most important to a certain precinct. That way, precious tax dollars don't end up in something that barely anyone in the area cares about, and more money goes towards things that are relevant to the people.
For example, a family of four would check ""education,"" so their money can go towards their children. Education directly affects the family. Now, say they never got sick. Then they would uncheck health care.
This system would be more efficient in that the money is prioritized.",,,We should choose where our taxes go   stance: i agree:,2
192,"I take the view that, school uniform is very comfortable. Because there is the gap between the rich and poor, school uniform is efficient in many ways. If they wore to plain clothes every day, they concerned about clothes by brand and quantity of clothes. Every teenager is sensible so the poor students can feel inferior. Although school uniform is very expensive , it is cheap better than plain clothes. Also they feel sense of kinship and sense of belonging. In my case, school uniform is convenient. I don't have to worry about my clothes during my student days.",,,Is the school uniform a good or bad idea:,3
193,books are always better than tv coz. books give more knowledge than tv does.,,,Tv is better than books:,4
194,How are we supposed to curb childhood obesity if we don't start at a young age?,,,Should physical education be mandatory in schools:,5
195,This is a rather simple choice for me. I choose pro-choice because I have the option to choose pro life. If I choose pro-life I have no choice.,,,Pro choice vs pro life:,1
196,"From a biological standpoint, men and women were ""engineered"" to be together. This idea was corrupted by the morals and society of our time.",,,Gay marriage right or wrong:,2
197,"Christianity conflicts with historical, archaeological, astronomical, biological, and many other forms of evidence. It denies rational & impartial common sense. Its teachings, written by an all powerful, all knowing, creator of the universe, are filled with contradictions. The arguments for Christianity just don't hold ground (bar one or two, and those are close). Atheism is not perfect, but it is the more logical position of the two.",,,Christianity or atheism:,3
198,"No one ever said science is PERFECT. That's the difference between Religion and Science, Science admits it doesn't have all the answers while Religion is SO dogmatic enough to not even recognise FACTS. And even just what TRUTH really stands for.",,,Christianity or atheism:,4
199,"I don't think that spanking should be necessary,spanking would last just a minute, but punishing could last up to 2 or 3 weeks or maybe more.",,,Human growth and development should parents use spanking as an option to discipline:,5
200,Dosen't it say in the declaration of independence that we have the right to life liberty and the purist of happiness,,,Gay marriage right or wrong:,1
201,"It seems that what bothers you most is the inconsistency of laws.  We have laws that are supposedly in place (like the seatbelt law) to protect ourselves from harming ourselves -- yet we have not legislated all forms of self-harm.  What I find most annoying is the artificiality of saying we pass these laws to ""save lives.""  I believe the reality is that we pass these laws to save other taxpayers for picking up the cost of a person's health care if they've chosen self harming behavior.  (Examples:  seat belts, motorcycle helmets, recreational drug use.)  If we were just honest, and said these things are illegal because we as a society don't want to have to bear the costs associated with medically caring for those injured as a result of less ""safe"" behavior, I think most of us would find such laws much less distasteful.",,,"Do you hate ""law"" as much as i hate ""law""?:",2
202,"in response to another person's answer, if cigarettes were made illegal, it would save countless peoples' health and lives. it would save hospitals thousands of patients with cigarette-induced cancer. 
i dont think that is a loss of money. it would only save lives and money.
besides, cigarette industry deserves to crash. i would love to see that day. 
all those sleaseballs selling death deserve to be jobless. not teachers and medics and firefighters.
those of you who support cigarette legality are losers.",,,Will cigarettes finally become illegal?:,3
203,"Yes, in North Carolina, there is a three day waiting period to purchase a hand gun. This is after you have taken the time from work to take a state mandated fire arms safety course, go to your county's sheriff's office and fill out the necessary paperwork for a criminal background check and FBI search and fill out an application for hand gun purchase. In the mean time, you could have bought as many of what ever you want off a street corner in one day and be done with it. The criminals have it made in this country...why do they make honest people go through so much to get a hand gun? I know other states are even harder to deal with....New York being one of the toughest! They're trying to make honest people not want to even have guns.

Why isn't there a national standard on the gun law? Should individual states be able to create their own laws concerning something straight out of the Constitution?",,,Do you know of any gun control laws in america??:,4
204,"Before you write your paper, make sure that you have the facts.

The press sells papers by exaggerating the issues. Guantanamo was an excellent example.  While the inmates were humiliated, they weren't tortured.  The accusations still spring up, however, and the UN is using the accusation to bash the US.

Additionally, the UN has determined that force feeding prisoners that go on a hunger strike is torture.  So, if you feed them, it's torture.  If you don't and they starve, it's torture.

Finally, prisoners will lie about treatment because it's a form of political power they can use while incarcerated.",,,Is torture ever justified? why or why not?:,5
205,"Not only this but anything 'intrinsic' to that person is more to do with an environment which is outside of their control than something they choose or even genetics.

""Give me a child until theyre 7 and i will give you the man""

The world is one big chaotic system. Literally EVERY SINGLE choice you make, even subcobscious ones come together to create your destiny so the choices you do make as an adult are a product of how the world treats you as a child and the seemingly meaningless mundane choices we make decide through butterfly effect more than the ones that seem meaningful anyway.",,,Cmv: a person becomes homeless because they live in a society that creates homelessness and not because of anything intrinsic to that person:,1
206,"not even close. owen wilson's kentucky fried accent goes in and out all movie, and the death scene in life aquatic pales to the suicide scene of luke wilson in RT. It helps that needle in the hay is playing. And the funniest 15 seconds of any wes movie (minus future man ""you look like a banana"" in bottle rocket) is the tennis scene.",,,The life aquatic vs. the royal tenenbaums   stance: the royal tenenbaums:,2
