id,source,rewrite_a,rewrite_b,issue,batch
105,"Well, as an active Pastafarian, I am disappointed at the lack of recognition of our religion. Along with Islam, Judaism, Mormonism, Roman mythology, Greek mythology, Norse mythology, Hinduism, Sikhism, Jainism, Egyptian mythology, and Buddhism.
But seeing as I am a theist, I must be on this side.
Don't you wish there was a sarcasm feature on the internet?",,,Christianity or atheism:,1
106,"Well ""The Champ"" It is not the Woman's body we are talking about, it is a new life. And if you are going to be irresponsible dont let a new life die for it!",,,Pro choice vs pro life:,2
107,Besides just a few people apply physical exercises in their life's!,,,Should physical education be mandatory in schools:,3
108,"Honestly I believe that both are good there is no better in this arguement, because they both have that significance and they balance each other out. Personal pursuit because you improve your self for others and the enviorment around you, and then advancing the common good, because the goods help you and others improve. Life isn't perfect and we don't live in a perfect world and I don't expect it to be that way. These two are no different nor are they the same but they are significant.",,,Which type of endeavor is better a personal pursuit or advancing the common good:,4
109,"a number of reasons..
because the girls are out looking for a good time with guys in perhapes the wrong places--ie the bar or disco or late night parties
because guys are  ""lacing"" drinks with drugs quite easily 
because the media portrays ""a good time"" for young people  as"" having sex""
and uncool to go without it 
because girls dont think their safety is their priority anymore and if parents try to warn them they react by going all out with guys giving them the opportunity they are looking for
because the ""safety antena"" of girls arent as sensitive as they should be to keep them from becoming a victim

thus date rape is a consequence of all these factors. 
so girls need to take care, be aware of your own safety dont give ""strange"" guys the upperhand if you dont want to be date raped..",,,Why do u think date rape is on the rise today?:,5
110,The conversation can not be used as evidence in a court of law.  I don't know what the lady hoped to gain from recording the conversation other than to create more drama.  Some people are hooked on drama and they actually do what they can to create it.  Run as far away and as fast as you can from these types.  They will suck you dry.,,,Is it illegal to record a phone conversation?:,1
111,"Don't you mean the NY Times? At least they happen to be the paper that the Bush Admin. is targeting. Although the Gov. has a web site, and a magazine dedicated to this very issue! Not to mention all the other media organizations that printed the same story... What a scam!
Bush himself has made over a dozen public statements, since 9/11, mentioning how they are disrupting ""terrorist"" funding!!!
Just another disgusting Bush Admin. tactic to distort and distract!",,,Will someone from the washington post go to jail for treason?:,2
112,"NO.

Whoever made the first 'response' is a prime example of how powerful propaganda is.
I don't ever remember hearing of a VALID case that had anything to do with the use of marijuana and someone being violent, much less some killing spree.

 Regardless of what the government provides as services for those who are ill, it shouldn't have the right to totally ban the use of certain substances. 
ESPECIALLY when those substances are LESS harmful than the ones that are legal!
Wake up guys! 


NEWSFLASH: You can die by drinking too much water! Just because you'll get help from a hospital or whatever doesn't mean they should ban water.
Where is your logic guys?


Also to those who whine about it being a gateway drug:
If it wasn't illegal, it wouldn't be a gateway drug.
It's made bad only by the hypocritical efforts of the government and the gullible people that trust their efforts.",,,Do you think that the govenment should have the right to tell us what we can put into our bodies like marijuna:,3
113,"Even when the sentence was ridiculous to begin with?  Non-violent drug offenders, who need rehab, not warehousing with real criminals, have often been given longer sentences than violent criminals.  I spent years working to get a woman paroled from a 20 year sentence for possessing 2/3rds of a gram.  And even though she betrayed me when she got out, and caused me deep hurt, I still do not believe it was fair that she was in as long as she was.",,,Do you believe in the early release system used for prisoners?:,4
114,"i don't know where you're getting the idea they make tons of money from putting kids in foster care.  it COSTS the state tons of money.  my sister does this for a living and their departements are severly underfunded and understaffed.  the workers do what they can but sadly, until everyone gets it through to their local officals that they want money spent on protecting abused children instead of tax cuts and expanding roads the situation is not going to improve.  it's really sad.  my sister alone has about 50 cases and she's sposued to visit the foster home, the parents, supervise at least 1 visit and go to court monthly for each of them.  there's just not enough hours in a day.  each caseworker should only have about 20 cases but they don't have the funding to hire enough people.  i hope your situation works out.",,,Do you feel that child protective services are doing there job protecting children.?:,5
115,"It's not legal because it can't be regulated by the government, because it's generally regarded as a gateway drug (one that leads to other, more dangerous drug use), and because, since it hasn't always been legal like in some European countries, legalizing it would not only lead to a massive initial interest in it-- which would lead to increased health care costs (don't front; it damages respiratory systems and impairs judgment) and decrease labor quality-- and all those drug dealers who sold weed would need to find something else to do, and my guess is it wouldn't be a legit job-- so it'd also cause a spike in crime; probably gun sale, or increased trafficking in worse narcotics.

It's a dumb f--king idea.",,,Why is marijuana illegal?!?:,1
116,"I think that could be a contributing factor. Plus, our media doesn’t show all the true horrors of war: refugees, dead soldiers, grieving families, etc. And the thousands of other grotesque nuances that cannot be translated well into media form, like the mental anguish, etc.
So, having a war on our own land could give Americans a taste of their own medicine. It’s easy to grow complacent when it isn’t your children being blown to pieces, your town left in ruins or your legs being blown off.
That why I cannot comprehend why people verbally attack people like Cindy Sheehan. How can you question her motives if you are not in her shoes? Only a coward would attack a parent of a brave soldier that died believing he was protecting his family and country.",,,Is americas complacency about war because this generation hasn't had one on it's own shores?   stance: yes:,2
117,"I enjoyed his briefing today. It is clear that he understands that he is taking hits by being compared to Bush's Katrina as far as this oil spill goes and understands the Sestak issue will have to be dealt with, whereas before, I don't think he or anyone else took it very seriously. What bothers me is that he took 77,000 from BP, yet directs the corruption between politics and oil companies being the problem. However, that cozy relationship was established long before he got into office. This problem has existed since before Carter was in office, so for him to keep pointing fingers at Bush is irresponsible.",,,Is obama a good president?   stance: no! get him out of office.:,3
118,"Let me start by defining what Wrestling should be:
Wrestling is the act of physical engagement between two UNHARMED persons, in which each wrestler strives to get an advantage over or control over the other.
Are we seeing this on television? No!
The definition above clearly contradicts what is happening on television today. Many persons can testify of seeing men and women using chairs, bats etc as weapons which means that they are harmed!
The violent approach of some of the wrestlers are terrible, i can remember clearly the ' UNDERTAKER' putting a rope around his opponent's neck while the steel cage was going up and it hung him. What a terrible sight!.....",,,Should we ban wrestling?   stance: ban it:,4
119,"Matthew 5:18:
""For verily I say unto you, Till heaven and earth pass, one jot or one tittle shall in no wise pass from the law, till all be fulfilled."" Unless Im missing something Heaven, and Earth are still in existance, and not all the prophetic events listed in the Scriptures have happend. I open with these words from the Messiah Yahushua himself, and take him at his word as he is no liar. I realize my post is not in a question format, but this is my opening statement in support of my vote/view on the question posed...The Torah/Law is forever!",,,Is the law (torah) of god (yhwh) for today?   stance: that the law (torah) of god (yhwh) has not passed away and is for everyone who has their allegiance:,5
120,"All we can say is a big IF because we are not yet 100% sure if this nation itself could lead the whole world. Who knows maybe in the future that India could fail to lead us. There are still other countries who are more progressive, more literated, more powerful than India, like the USA, United Kingdom, Russia, Japan, etc. This nation doesn't have yet enought potentials and ability to sustain the needs of the people. India is not yet that full of technologies like in the Americas. Well in fact technology is one of the most sophisticated and essential inventions ever created.",,,India has the potential to lead the world:,1
121,"This not only degrades morality, it also affects how women are treated in society today. This is against women empowerment in a sense that women are viewed merely as sex toys. Which at the end of the day affects how men perceive women which will in turn lead to a lot of disrespect and false perception.
Now, how about crime rates? Murders, Rape, and Sexual Abuse. According to studies, all these people who committed these grave crimes all had one thing in common: PORN.",,,Is porn wrong:,2
122,"jarman:
porn is wrong because it sholud be in 4-D with surround sound and special effects :) it would make it much more pleasurable btw im a girl........",,,Is porn wrong:,3
123,"if physical educations r not ter then u wud b a couch potato
!!!!!!!!!!!!!!!!howzz tat???",,,Should physical education be mandatory in schools:,4
124,"What - is God coming in the year 2100 to judge us then? Not in 2000?
Why would God have to tweak anyhow. The guy is all-powerful. So he created some single-celled organisms billions of years ago, and then said to himself ""I'm going to set this thing called evolution going and see what happens. Yes, I'll tweak these tiny organisms a bit. Then maybe humans will evolve some day and I can make Mary give birth to Jesus.""
Yes, that all makes a lot of sense. A good use of God's time.",,,Evolution vs creation:,5
125,"This is planet Earth, shared by billions, not just you. If given the opportunity to advance the human race, every person alive should take it; choosing personal gain over advancing the common good is selfish. There's no other way around it. I don't want ot hear ""it's human nature to be selfish"" or any other lame excuse. The point is we all live together, and if your too greedy and self-centered to care about your surroundings and the individuals around you, your merely taking up space.",,,Which type of endeavor is better a personal pursuit or advancing the common good:,1
126,Good idea for separate student from other people for at least increase garment job. Why we use soldier uniform? For separate from civil. Why terrorist not use soldier uniform? For harmonious with civil and easy to attack enemy.,,,Is the school uniform a good or bad idea:,2
127,It's better to have a lousy father for practical reasons. You can blame every mistake you've made on your father. He won't pry into your business and search your room and take your stuff because he doesnt think I need it. He wouldnt care so much that he would get pissed and throw my backpack with my computer in it at a wall putting a hole in it because I didn't clean the sink after breakfast or I forgot my keys. I think it's actually an opinion because that kind of father is still lousy because he'll tell you that he hates you and I ruined his life.,,,Is it better to have a lousy father or to be fatherless:,3
128,"Same sex marrage can couse a lot of contriverse, it puts peoples life at risk in extrem cases gay marrage has caused so much trouble pepole has resulted in murder and sucied",,,Gay marriage right or wrong:,4
129,"i remember the only country by whose fear alexander's army was afraid
it was INDIA
after just sixty years of independence INDIA is looked as the country to become the sixth member of security council of UN
and it is also the country with a great development rate
And i know that none of us are unknown to the great contribution of INDIA in the discovery of god partical
then from where the matter comes from that INDIA is not having the pottential",,,India has the potential to lead the world:,5
130,"I believe a personal pursuit is better for me because I'm more of a selfish person. I rather do something that is going to better my life, but every once in a while I do have my giving moments, so I guess it depends on how I am feeling. Right now I am going to go for the personal pursuit.",,,Which type of endeavor is better a personal pursuit or advancing the common good:,1
131,"Lets see 
Hitler committed suicide in a bunker in Germany in 1945 which makes him DEAD.
President Bush is alive and well in the year 2006
Unless one of them can time travel its impossible for them to be the same a********.  I understand about the different s**t part.
I may never get to level 4 by answering all these types of questions but its starting to get less boring see ya",,,"Bush n hitler,  same assholess, but with different shitt... comments??:",2
132,"that depends.. I lost a friend a year ago to drugs.. very sad...

Drug use in general is psychological thing... there are studies that suggest people who use drugs are self medicating for some other diagnosable mental illness....

for example.. many alcoholics are found to have symptoms of anxiety and panic disorders... this is a good example of peer pressure.. nobody wants to hear about a grown man acting like a sissy?. society says.. ""hell no.. lets go out and drink..""

the problem with drug use is.. you are covering one problem with another.. therapists will have to spend many years dealing with the drug problem before they can even begin to address what caused the compuslion to use drugs...

so yes. i believe in treatment.. i believe you should help yourself... however.. one can only get treated if they are willing to accept help.. for repeat offenders .. i offer no sympathy..",,,What do you think of a person with a drug habbit ?:,3
133,not really cause u didn't fill out an accident report and your work will argue u did it at home and u have not proof that u did it on the job that is why even a minor cut should be reported to your supervisor or u have no case did u tell anyone that your back was hurting before u left work and if u did they have to sign an affidavit that u did hurt yourself on the job and put their job in jeopardy and risk losing their job too so if u do hire a lawyer u better be ready to fight a long and powerful battle and nine times outta ten u lose so its best to goto the chiropractor keep your job and mark this up as a lesson the next time tell someone a couple hundred dollars is worth more losing your job and possibly getting black balled from gettin another cause when u fill out an app i don't care what anybody says your ex employer can black ball u and tell them what happened and u won't get the job,,,I am from illinois do i have a case for workmans comp or something of that nature?:,4
134,"Dear Friend,

I'm not sure I agree with the premise of your question.  Racial profiling consisted of a systematic suspicion of particular minorities as inherently criminal.  If insurance companies were to charge all, say, black customers more than white customers on the suspicion that black drivers get in more accidents, I'm quite sure they would be subject to suit.

But, in any event, law enforcement personnel carry and use guns and handcuffs, send people to jails and prisons, have the capacity to ruin the lives of innocent people who happen to be of a particular minority.  Insurance companies... sell insurance, which you can get from hundreds of competitor companies.  Discrimination in law enforcement just matters a whole heck of a lot more than discrimination by insurers.

Your Friend,
Francesois",,,Why are insurance companies allowed to profile but law enforcement isnt?:,5
135,"I think black people have their rights protected. The state gives them the same rights as others. And don't give me examples. It won't change my view. I am aware that probably their education rates are lower and their poverty rates are higher, but it doesn't matter. That's probably affected by the discrimination that happened in the past or it's just their fault for not being successfully integrated into society. As I said I don't want to see statistic about poverty, education levels, criminal levels, how many of them are living in ghettos or what % of them are in the higher positons of the state hierarchy. I want facts about how are they actually discriminated.

PS. Sorry for grammar",,,Cmv: i think there is no racial discrimination in the developed countries:,1
136,"Violence is perpetuated and caused by society.
Advertising reminds us of all the things we do not have and makes us feel inferior for not having them.
The news makes us distrust each other. Our distrust of each other causes us to treat each other not as people but as things to interact with.
We have people screaming at salesmen- why? Because we don't see them as the same as us. What makes a telemarketer so evil but the high pressure of modern living forcing them to not let you off the phone.
We kill because we feel upset with our own lives, we are frustrated because we are sent images of friends that we'll never have, products we can't afford, and movies full of lives we'll never live.
It's not video games, it's televison programming and society that cause this. There are fewer suicides in small farming communities than in large cities, and less murders, because people are more close knit and friendly to each other.",,,Jack thompson   stance: do you think that jack thompson is right. that video games are the reason more and more young people:,2
137,I think it is bad to wear school uniform because it makes you look unatrel and you cannot express yourself enough so band school uniform OK,,,Is the school uniform a good or bad idea:,3
138,"well, India is finding difficult to manage itself first...so there's no question of leading the world so far....but still if we compare so lets have a look at the following points:
1. almost 90% of India is illiterate(don't be sure of the percentage), so an illiterate country can't lead the world....
2.India is more into castes, politics, religions and less into development.
3.the most important thing is that India doesn't have confidence on itself and is still cursing itself...
So if it goes on so then it is difficult or even impossible to say that ""INDIA WILL LEAD THE WORLD WHEN IT CANNOT LEAD ITSELF!!""",,,India has the potential to lead the world:,4
139,"in the past, children could walk around as they pleased, to and from the candy store, to and from school. now there are child pornographors, sexual predators online. porn has opened the doors to new crimes.",,,Is porn wrong:,5
140,"Oops, I meant to say creationist version of evolution. My apologies.",,,Evolution vs creation:,1
141,I can prove to you that humans have not evolved since the beginning of recorded history,,,Evolution vs creation:,2
142,"That doesn't make much sense. Why are we still evolving and the monkeys aren't?
Why aren't fish jumping out of the water and growing legs?
I mean, if it happened billions of years ago than how come its not happening today?
Why can't we find psuedo-hybrid fish with legs forming?
What caused evolution to stop happening for a mysterious time of thousands of years?",,,Evolution vs creation:,3
143,Some people say God is against porn. But we won't know that because the bible does not mench porn because it did not exist during biblical times. So how do we know it is a sin?,,,Is porn wrong:,4
144,"Means you don't have to worry about what you hve to wear!
Less awkward when people say wear school uniform and you wear mufti...",,,Is the school uniform a good or bad idea:,5
145,I like tv because you can watch all the porn you want with your family,,,Tv is better than books:,1
146,ndians has always been powerful why r u forgeting about its ancient glory history,,,India has the potential to lead the world:,2
147,"Christianity strives to promote better morals and ethics. What does atheism contribute? Nothing. To believe that one should follow the ways of Christ, what harm is there. Real or not, Christ is still a better example to follow than any atheist. For a ideology to be better than any human must really piss off those that fall way short of it.",,,Christianity or atheism:,3
148,"What?!? And all these years I've been paying. . .
No, we are absolutely required to pay income taxes! We actually OVER-pay each year, and then in the Spring we get a partial refund. That's always nice, to help cover any credit card purchases we may have made at Christmas, or to do a home improvement project. But many Americans end up having to pay in even more, because not enough has been deducted from their wages throughout the previous year. OUCH!",,,"Since americans are not legally required to pay tax, do canadians need too?:",4
149,"You have all missed the point.

Confidential sources within the Government that leak classified information  are not covered by the freedom of the press.

When a court order is issued, there is more at stake than a news story.  Often the court order compromises one case to resolve another.

When you have someone that leaks vital information that threatens the welfare of the American People (nuclear secrets, etc), you might give up a case against a squealer to get the name of the mole.

Freedom of the press means you can publish what you want.  It doesn't mean that you are free of the consequences.

Geraldo got thrown out of Iraq for airing the American battle plans for Bagdad before the battle.

He shoulda been hung.",,,Do you believe that news reporters should go to jail for what they write?:,5
150,"Marriage is a business, and the license makes it legal.  It is there to protect women's interests as far as property is concerned, and for raising children.  It is a protection.  if you don't plan on staying with someone, or having children, or making property community, there is no need for it.  People shouldn't enter into it lightly, and I think it would help the divorce rate if the benefits of marriage were eliminated.  People couldn't marry for money, or insurance, etc...",,,Does remaining life partners make more sense than marriage?:,1
151,"Saying it with an ""a"" and saying ith with an ""er"" is no difference. Think about it, Most Black people cut the 
""er"" off of words in the first place, while white people don't. So the actually pronunciation does not take away form the degradation of the word. I have been black all my life. I have listened to my mom say it, I have listened to my dad say it, but I never really used it.(sometimes by mistake if the people that I am with say it a lot, but i ALWAYS correct myself). I hate that word, and its use. I think people use it because they are afraid of saying something else and looking ""corny"". When I was in college, I suggested Not my ""ni99a, my brother"" day, and it worked.",,,Why do black people call each other the n word?:,2
152,"When considering any changes to the structures of any of their professional leagues, a lot of arguments revolve around how parity can best be maintained or enhanced.

I don't see why anybody cares.
The most exciting moments and periods in sports happen when there's a handful of titans ducking it out, not a mediocre field where anybody can win.

Sure, Barcelona/Real Madrid/Atletico Madrid are miles ahead of most of their competition in La Liga. But tons of people who otherwise would never watch a match will tune in when they face each other.

People don't tune in to watch games between two middle-of-the-pack teams nearly as much as they do for games between the top two teams in probably any sport.
True parity, if achieved, would mean that every team is a middle-of-the-pack team.

Why should I prefer that than having a handful of teams that are truly great and exciting to watch?",,,Cmv: the us' obsession with 'parity' in sports is misguided.:,3
