id,source,rewrite_a,rewrite_b,issue,batch
54,"All these arguments about that porn leads to addiction are annoying me now -_- . Porn hardly ever leads to addiction, just in weak people, maybe who have mental health issues, or attachment issues or find it hard to separate fantasy from reality. I watch porn once or twice a day when i'm on my own but also have a great boyfriend and we have sex once or twice (sometimes three, if i'm lucky!) times a week, we use porn to spice things up in the bedroom but we know it's all fantasy, we're not idiots, we just have desires that need to be met!",,,Is porn wrong:,5
55,"I wouldn't live my life right if I never got to meet my father. I wouldn't care if I grew up and had lousy father even if he has no job or life and maybe even an alcohlic. Having a father means alot especially if your boy because most fathers are friends to, so you can talk to them about guy problems and they would understand the situation and with just living with your mother you couldn't because she's a woman and her views are different then a guy. Whether its a good or lousy father they will always be there for you at sometime in life.",,,Is it better to have a lousy father or to be fatherless:,1
56,"religious people are always using the same argument: you cant prove he doesn't exist!!!!you CANNOT disprove a negative. meaning, you cant prove something is not there,which already is not there.",,,Christianity or atheism:,2
57,"god aint flipppin real, so get over it u dumb belivers of god",,,Christianity or atheism:,3
58,I believe that spanking you child because it shows then that what they did was wrong and if they dont want the feeling of a but woppen then they wont make the same mistake twice.,,,Human growth and development should parents use spanking as an option to discipline:,4
59,"No one objects when those who COMMIT crimes are extradited...justice should be served even if criminals flee.  However, we all know that accusations are made against innocent people, and that not all legal systems are the same in terms of fairness.  It is only natural that courts that have the accused before them who face trial elsewhere are going to want to be pretty well convinced that there is a solid case to answer before they send them abroad.",,,Is extradition fair?:,5
60,"It wasn't just the jews, hun.  

The nazis weren't acting out of hate, like Stalin.  They were doing what they deemed right.  ""The Path to Hell Is Paved with Good Intentions"".  

They wanted a master race, and sorry to say, but jews, and miscellaneous others did not fit that category.

They did whatever they could to accomplish the master race.  They weren't exactly hating the people.  They were just using the same cruelty we use when we experiment on animals, or give them horribly adverse living conditions.  We view ourselves better, and them as inferior and having no feelings, and no right to live happily.  That's what the nazis did to various people groups.

Stalin just treated anyone badly that he could treat badly, and enforced a ""Harvest of Despair"".  You should watch the documentary below:",,,Why did the nazis hate the jews so much as to gas them?:,1
61,"Answer is NO! However, I think the bigger problem is finding out who leaks this information, there are a lot of Clinton era hold-overs.

Newspapers are in the business of bashing Bush, so they will do whatever it takes to hinder the war effort, and then hide behind freedom of the press. It is getting people killed, and prolonging the war by telling our enemy everything they need to know.",,,Should newspapers that work against our war effort be tolerated?:,2
62,"It's boring. Kind of scary. 
I am not going to complain about the regular sex.
shower time could get right out of hand.
seriously it is a drag. 
Psychiatric wards can be scarier, but you don't necessarily have to sleep with guys if you are broke and need a smoke, lot's of good looking loonies(I can say that I own that word) in the hospital and you cannot catch crazy so it is worth going for it.
So each has it's pros and con's but I would have to recommend psyche ward over jail. and jail over my last marriage.


oh for the people that say you lose your self respect, speak for yourselfs. i am just dandy.",,,What is the worst thing about being in jail?:,3
63,"There hasn't been a president with a moustache since William Taft in 1913 and, since then, people with moustaches haven't been seen as trustworthy thanks to people like Adolf Hitler, Joseph Stalin, Karl Marx, Vladimir Linin, Saddam Hussein, Osama Bin Laden and many more. When the fingerstache meme first became popular I was mortified because the moustache is now a symbol of barbarism and brutality towards man. To me, anybody that throws up a fingerstache might as well be throwing up a Nazi salute, it's a confession of their secret desire to turn back to barbarism and project their hipster (or should I say Hitler) tastes and preferences onto the populous by way of force. Worse still is the fact that Americas rampant consumerism has created an insatiable hollowness inside the heart of the hipster that can only be filled with fingerstache pillows, quality coffee, and eventually fascism. Each moustache that sprouts from the faces of my beloved citizens is, in fact, a black, hairy, evil flag.",,,"Cmv: the moustache, facial hair in general, has become the embodiment of evil and the harbinger of bad times.:",4
64,"The schools are teaching kids learned helplessness.  It only causes the true victims of the school to suffer at the hands of administration.  The current ""Stop Bullying"" campaign is propaganda to keep kids from recognizing themselves as autonomous beings and is a key reason why there are more school shootings.  When you back an animal into a corner, it will strike with full force.  That is what the school system and laws in place do.  

I also believe the laws in place are turning kids into people who can't solve problems on their own.  ",,,"Cmv: the ""stop bullying"" campaign is total bullshit. the best thing we can do is let kids defend themselves.:",5
65,"no the world will not end NASA keeps looking and we won't get hit for i thimk it was 3,000 years
the funny thing is made a bet with my friend if the world doesn't end in 2012 i get $5 if it does he gets $5 he said ""if we see the asteroids
i have to pay up"" i can't wait for those $5 LOL
The Master Chief",,,"Is the world going ot end in 2012?   stance: yes, the world will end:",1
66,"In the United States of America, pro-choice is the only constitutional way to go. Elsewhere in the world, people will do whatever they want.",,,Pro choice vs pro life:,2
67,"Oh lol. People to point this out believing in God is called ""faith"" and we don't need proof to deal with this atheist's. The idea of God is false is your own words, and I don't have to deal with this , whatever you think is your faith so we won't stop you. Both side contradicts each others belief and no one truthfully wins. This is probably a fight between two armies where both doesn't win until the end. Mainly , I support Christianity because of my ""faith to God"" and your proof that God doesn't exist doesn't change the case or turn it the other way around.",,,Christianity or atheism:,3
68,"i'm not a Christianity but i mean if your a Christianity, you really can't argue with them at all unless your argument is base on on the same subject. kinda of like Street fighting and UFC. different platform.",,,Christianity or atheism:,4
69,"It must not be mandatory, but at least a requirements but not more often. How would you consider PE if the child is not so well? And if possible separate boys from girls, for boys assign some good games of physical education activity to them, same thing with girls, give them games for girls ideas.",,,Should physical education be mandatory in schools:,5
70,"Gay marriage bans, along with other laws, are only in place because of the religious right that seems to be infecting this country. The UNITED States of America can only remain united if laws are created with all men and women in mind. To have a law that favors one religion, or lack thereof, over another is the bane of freedom. Secular law is the only law that works.
Leviticus 20:13: ""If a man lies with mankind as he does with womankind, they are both commiting an abomination, they shall be put to death, their blood is on their own hands.""
There's a loving god, eh?",,,Gay marriage right or wrong:,1
71,"The deal is: ""Freedom of speech goes both ways""

People not only have a right to say pretty much what they want, other people have a right to object, argue & even ask for an apology. 

A liberal says something, a conservative objects & the conservative is bashed for 'violating a person's freedom of speech.' 

A conservative says something, a liberal objects, and conservatives either let it drop there or defend the original statement on its merit.

So who is really against freedom of speech;

The conservative who asks a liberal for an apology for an offensive statement, or the liberal who acts like you aren't allowed to express the fact your offended by a statement?",,,So much for the first amendment!!!?:,2
72,"Capital punishment is simply the best law enforcement out there. Ask any country that has employed it. You'll find that their crime rates are MUCH lower than the USA's. This only applies if the nation is comfortable with it of course. 
On the other hand, its immoral for a man to take another's life no matter what the situation since you are assuming a position of superiority when you do so and every man on the earth is equal. Despite its effectiveness, there are multiple other alternatives to it and capital punishment should not be a first choice.

Its simply a matter of perspective in the end.The typical christian perspective goes against capital punishment and thats due to this christian country. 
The simple truth is that its effective but at the same time, from a biased perspective, its barbaric, immoral, and there are better, though not as effective, solutions.",,,How many of you support capital punishment and why?:,3
73,"To answer your question and to refute the genius who compared captial punishment to abortion:

The fact is, yes, there have been far too many instances where people have been put to death then later found innocent.  Our judicial system needs to put policies in place that will prevent this from EVER happening.  But generally, if a person, without a doubt, has been convicted of a malicious crime, they should be put to death.  How sane is it to allow someone who raped, tortured and killed a young girl to sit in a jail cell and live off taxpayer money?  If that individual feels someone INNOCENT deserves to die, why should they be allowed to live?  Again, I believe there should be WITHOUT a doubt concrete evidence against a person who is put on death row.
And concerning abortion...unborn babies have not committed heinous crimes.",,,Should capital punishment be allowed?:,4
74,"Absolutely not. That's when we NEED those freedoms the most.

We need to be able to say that ""I don't like the way the administration is handling things"" without fear of someone putting us in prision. 

I may not agree with someone else's opinions. But I'll fight to the death, to make sure they can state those opinions.",,,"Should our freedoms of speech, religion, press, and the right to assemble be suspended during war?:",5
75,"It has been proven to the satisfaction of many people, but there are some that are extremely hard to convince, for a variety of reasons. These reasons are mainly faith based, in that they have faith in the government, and do not want to believe that their government could murder three thousand of its own citizens. They will all wake up in due time, probably when the country is under Martial law, with curfews imposed, and they become prisoners in their own house.
That's for the lucky ones of course. The less lucky will become prisoners in the 600 or so concentration camps which have been built around the country, and are already manned and waiting for their presence.",,,It's been proven 9/11 is an inside job.?:,1
76,"I like very much the way you started: ALL RISE!
And there is no legal system which is perfect!
Moreover, though, I do not trust ""god"" and this is due to the fact that god never talks to anyone, except the leaders (which gives me suspicions that the leaders claim they were told by god! - what do you think?)
For example, whenever someone attacks another, in the last 16 centuries, they claim that god ordered them to do that! Last, but not without importance was the Bush claim for America's and her allies to Iraq!",,,"All rise! i would never honor any earthly man, especially the crooked, hacks that we have as judges.?:",2
77,"last time i checked he still has the right to a court appt attorney..until then if you can""t make bail or get a bondsmen then i guess he will have to tough it till his court date.....if he hates it that bad..then maybe he won't make the same mistake again when choosing a girl. We all have our lessons to learn, some get the rough end for seemingly no reason sometimes..but this is life and you can't always come to their rescue.....even when sometimes you feel you need to...grown up problems come with grown up consequences that are sometimes hard to fix. Sorry",,,I have a son that is in jail in atlanta ga and needs help.we cannot afford the high bail.and legal cost.?:,3
78,In my opinion Nascar is not a sport and should not be considered one. First of all it's about as entertaining as watching cars drive on the highway. I don't know how anybody who can stand to sit in a stadium for several hours in the sun watching cars drive really fast in circles. How the hell is that entertaining. I'd rather watch a cricket game! The drivers don't even have to be in shape. As long as they don't have high blood pressure their bodies can endure. So why does anyone like such a pathetic hobby?,,,Cmv: nascar and formula 1 racing are not a sports.:,4
79,I would be in favor of that. My personal convictions could never allow me to support caging an animal up behind bars for the amusement of people. Animals are meant to be free. Of course nothing like this would ever be taken seriously by a substantial amount of people because for the most part animals are viewed as inferior which then justifies locking them up. F**k zoos.,,,Should zoo's be made illegal?   stance: yes:,5
80,"I play guitar and don't feel like I suck. I believe I am quite capable of expressing myself on the instrument. Oh yeah... AND I LOVE GUITAR HERO! It actually helps to improve dexterity and coordination as well as strength and speed.
P.S. Can people try and spell a little better at least with the titles of the debates. I mean, come on, they let ya know when you've misspelled a word. Although whoever created this one spelled the word correctly. They just typed the completely wrong word.",,,Is guitar hear for losers who cant play real guitar   stance: no:,1
81,"In a society traditionally and, to be honest, still dominated by men, men's general consensus is more popular than women's general consensus, and I think we all know that a lot of men consider lesbians to be downright sexy, because there is no man in the picture to ruin the aesthetic. (Vice versa for gay men.)
Additionally, gay women are more ""socially acceptable,"" for one of the traditional reasons behind homophobia: women are inferior to men.
Gay men are discriminated against because they have no honor: romantic interest in men is for women only, and when an man participates he is ""lowering himself"" to a women's level.
Gay women, on the other hand, are discriminated against less because romantic interest in women is a man's attribute, giving them honor.
(The preceding is not my opinion, but instead my rather cynical interpretation of modern society)",,,Do lesbians have it easier than gay men??   stance: lesbians are more socially accepted by straight people:,2
82,"because your own clothes are coolio hoolio, and if you get to wear what you want its coolio hoolio",,,Is the school uniform a good or bad idea:,3
83,"Who said anything about FF/mozilla having anything to do with steve jobs/apple? Seperate enititys, not in the least bit attached!
BTW, IE blows when making pages and trying to get things to look right. FF sticks to world wide web consortiums standards much closer than IE ever did or will.",,,Firefox vs internet explorer:,4
84,this does not even make sense no one country should lead the world we all started together and thats the way it should end and everyone has there ways this is just not logical at all,,,India has the potential to lead the world:,5
85,I rather have a lousy father then not have a father at all. Having a lousy father you have a father that cares for you and loves you. You can fix if he's lousy you can talk to him and knock some sense into him. I think it would hurt me not knowing who my father is and would want to know who he is. As long as you have a second parent that you can talk to when you can't talk to your mom about. I don't know how it would be if it was only my mom raising me.,,,Is it better to have a lousy father or to be fatherless:,1
86,India is in my personal list of countries to keep an eye on over the next thirty years. I think they're a good contender for superpower status before the end of this century.,,,India has the potential to lead the world:,2
87,"Even if there was a valid proof for the existence of god, there would be no valid proof that that god is Christian or not.",,,Christianity or atheism:,3
88,"Humans have been raised for thousands of years with not near as much resentment towards spanking and today's kids are the unruliest there are...
There's a trend...
(I do admit it's not purely spanking that's the cause but it's a small part of the bigger picture)",,,Human growth and development should parents use spanking as an option to discipline:,4
89,"I have lots of gay friends. I'm all for it!
People should stop being so against it. People can't help it. I've watched shows about it and I can really see how gay people feel.. when people are looking at them and some of them feel like they are being watched. It is just not right. We are all human.",,,Gay marriage right or wrong:,5
90,"Thats just liberal ignorance. A criminal will find a way, be it a gun, knife, baseball bat...It's just ""feel good"" legislation. Makes the liberals think they are doing something to combat crime (while letting the criminals run rampant)

Statistics show that criminals do less when up against a well-armed citizen. (And crime rates drop). And for the record, the second amendment is there, not to protect our hunting rights, but to allow us to have the ability to fight back against a governement that goes out of control. And hunting rifles against machine guns isn't an even matchup.",,,Gun control?:,1
91,"Grrrrr....

EDIT: Don't bash Clinton! He eliminated the deficit, and we had a surplus for a short time. All the while we survived and the economy was good. Bush blew it. He saddled us with that deficit. what's it up to? Eight TRILLION plus? Who's paying for the Iraq war? Who's paying to rebuild the place? Where is the Iraqi oil money? They are selling oil. Where do you think that money is going? Hmmm....",,,Bush to reduce deficit with domestic cuts?:,2
92,"We've got a bunch of Good Ole' Boys up there scratching each others' backs, making a living off of us and turning it into a career. Need to enact term limits of no longer than two terms in both House and Senate. 

Get those 80-yr old geysers outa there. They've already earned their lifetime pension and benefits.

Good people go to D.C. with good intentions, but they can't do anything by themselves. So in order to get their Bills passed, they have to help pass someone else's Bill that is established there and knows how the system works; the Good Ole' Boy System, that is. 

The Good Ole' Boys are just biding their time, keeping their system going and blocking everything else. They work for themselves. 

All incumbents -- OUT!",,,"Patriot act was passed unread, is anyone in congress of usa worth his or her salary ?:",3
93,"How can it not?
Inside they have their own laws, and I do not mean prison laws.
To live you obey them, if not you could very well end up dead.
It is sad to say but some of our prisons are run by the gangs inside them.
The prisoners behind bars have it so good any more that prison is no deterrent to crime at all.",,,Do prisions create a criminal personality?:,4
94,"Why, gay man here, can be fired for being gay at any job in the country, can't have a civil union with my partner of 9 years, no domestic partnet rights, hell if it were up to some I would be better of on some deserted island with like kind........not free for me.......but still grateful to be an american and for those fighting for what rights i do have",,,Why is our government lying to us?:,5
95,"Those who are calling for amnesty to be given to illegals have yet provided any rational reasons as to why they should be given citizenship. Here are some of the arguments given and a replies as to why they hold no argument.

""Deportation breaks up families""

Okay, so do incarceration or divorce agreements. Should we end 20 year sentences because inner city children have fathers who were separated from them for committing fraud or theft.

 ""Illegals are the reason why we have cheap vegetables and they do jobs that Americans won't do.""

This argument actually turns against amnesty proponents. Illegals do  unpleasant jobs due to not being eligible to compete for jobs citizens are willing to do. If they receive amnesty, they would opt out of doing the dead end jobs they were paid peanuts to do. 

"" Texas was Mexico's""

This argument is very asinine. This statement makes an argument in terms of territorial acquisition. What illegals want is sovereign status, not territorial status. 

I have  plenty more, but I'll wait until a debate commences.",,,Cmv:there are no rational arguments as to why undocumented people in the us should be given amnesty:,1
96,"I'm not the one who created this topic by the way. But people free to their whims and desires are malicious, myopic, primitive, subject to vices, cannot be trusted, and must be kept in line, to a certain extent. It doesn't matter how good those Randite arguments sound good in THEORY, 100% pure capitalism won't work. Note that I am not advocating socialism, just controlled capitalism.",,,Laissez faire ?   stance: no:,2
97,"i think black ppl give more of a bad name!...only bcuz more then half of all jails are black ppl and u barely c white people on tv when anything bad happins! u mostly see rappers who r black go to jail for some stupid stuff and u nevr c any country singers that r white go anywhere bad!..im not sayin white ppl arent bad to cuz there are things that go on with them to but its all mostly black ppl!!...i think all monkeys and krackers shouldcreated equaly....but seperatly!
",,,"Who gives society a bad name,,,black people or white people?   stance: black:",3
98,"Unless you want security to manhandle your fiancé don't go here.  I don't care if Tiesto or Calvin Harris is playing here it is a joke. Security should protect their guests, not make it more difficult and/or hurt them.  My fiancé had a bruise on her arm and soar for a few days.  Way to have a 300lb security guard push a shove/grab a 120lb woman in heals, hope your ego is soaring.  And btw we hadn't had a drink yet.",,,"Business review: 1.0 stars
business name: hakkasan nightclub. city: las vegas. categories: nightlife, chinese, lounges, cantonese, bars, dance clubs, restaurants:",4
99,"We have been to Carpe Diem a few times before their move to Elizabeth.  We tried it again tonight for our anniversary dinner.  Big Mistake. While granted, it was a Monday night (I get that in the restaurant industry), the food was pretty much awful.  Over-seasoned...overdone. Steak overcooked; Quail undecipherable in it's bed of black (white) rice and syrupy sweet sauce.  Wine overpriced. Salad uninteresting and dressing was boring.  Appetizer meatballs....well, regular meatballs without pasta. The descriptions were nice but the food didn't live up to it.  They had our table decorated (for our anniversary) but didn't offer a glass of wine, an appetizer , nor a dessert for our special occasion.  Expensive and um...""let's just go home and have a glass of wine."" kind of night.",,,"Business review: 2.0 stars
business name: carpe diem restaurant & caterers. city: charlotte. categories: american (new), nightlife, vegetarian, bars, american (traditional), lounges, event planning & services, venues & event spaces, caterers, restaurants:",5
100,"Ha ha, no.
India was most successful when it was ruled by other empires, they cant even lead themselves.",,,India has the potential to lead the world:,1
101,"Nah, they can't even organize their damned streets! They bathe in the same river in which they bury their dead and defecate in - the Ganges! They're extremely poor - they can't even manage their own budget, much less a planet!
I'm going to get down-voted and insulted, but everything I have written is the truth.",,,India has the potential to lead the world:,2
102,You are 100% right because I am in Pe and they make us wear these stupid outfits. I think they make us wear those so the Gay coaches can see our private parts. and PE is just Stupid,,,Should physical education be mandatory in schools:,3
103,Yeah I have a bottle of water next to me its no bid deal!,,,Ban plastic water bottles:,4
104,HOMOSEXUALITY IS WRONG!!!! And I like this website but I don't find it very clear. This one is better : theworlddebating.com,,,Gay marriage right or wrong:,5
