id,source,rewrite_a,rewrite_b,issue,batch
0,students should wear what they like and feel free about their clothes,,,Is the school uniform a good or bad idea:,1
1,I thick that book are better than TV is it is better i can put you in a whole norther wold and it is educational,,,Tv is better than books:,2
2,"Books enlighten the soul. Books don't destroy the morals of children. Books throw the mind into a series of questions, they take the readers to mystical places, paradise, and even the kitchen sink. They change your perspective on life and often give the reader a sense of relativity. Television is like a drug. It's as bad as nicotine. Fahrenheit 451, the Night Circus, The Secret Garden, Inkheart... Do I have to further explain..?",,,Tv is better than books:,3
3,india is is good adopter but a bad developer and leader should be a great developer,,,India has the potential to lead the world:,4
4,Raffles had written his discovery wrongly as 29 February 1819.It was later corrected. He thought he had discovered Singapore on his firs journey,,,William farquhar ought to be honoured as the rightful founder of singapore:,5
5,"I am a nurse and the more I studied biology, the more I was in awe of the miracle of our bodies. Every tiny cell has it's own design that is even more complex than a computer. When you look at a computer do you question that there had to be a creator? Or do you need proof that this highly organized machine came to be about by a mere accident or order of circumstances? Evolutionists need more faith than Creationists.",,,Evolution vs creation:,1
6,Porn isn't inherently wrong because It really can't substantially harm anyone who isn't involved in it by choice.It really is just as simple as that.,,,Is porn wrong:,2
7,there aint no sunshine without plastic water bottles. only darkness everyday.,,,Ban plastic water bottles:,3
8,"how can Indians say that india don not have the potential to lead the world???????????????
India is the heaven in the Earth and only India have the potential to lead the world..........
Believe yourself and hardwork.............
surely INDIA WILL BECOME POTENTIAL TO LEAD THE WORLD other-than any country!!!!!!!!!!!!
JAI HIND",,,India has the potential to lead the world:,4
9,"The government has no place to tell a woman what she can do with her own body, ever.
The government DOES have that right.
1) a woman cannot legally prostitute herself in many states
2) a woman cannot take illicit drugs into her own body
3) a woman cannot use her body to murder others
4) a woman cannot use her body to steal
5) a woman cannot display her naked body in public
there are many others. Men can also not do these things.
The government tells us what to do with our bodies ALL THE TIME. This is no different.",,,Pro choice vs pro life:,5
10,"I am Pro-Life,
Here is a question for anyone who is Pro-Choice: Is the baby in the mother's stomach living and if not how do you know?",,,Pro choice vs pro life:,1
11,"No.  That is the beauty of the USA, you have no health care.  Why would it change if you had to go to jail while the rest of the public pays their hard earned money into taxes.  You brother is in a jail for a reason, maybe if he had contributed to society instead of commiting crimes he would not be in this situation.  Jail has no company benifits.",,,My brother is  @ a tx state prison he's broken his two front dentures and they do not want to fix them!?:,2
12,"I feel that its totally against everything that is American. How about everyone straps a GPS system to their legs so the government knows where everyone is, oops that's right cell phones i almost forgot. Besides this the government is saying its all in public safety, but i dont kno how safe i feel if i know someone is listening to my phone calls. Give me a break if i wanted to blow some shit up I wouldn't talk on the phone to make plans for it anyway.",,,How do you feel about the recent phone record ordeal?:,3
13,"In one sense you bring up an interesting point.  Let me challenge you with a broader concept...

...do our Laws reflect our Morality....or does Morality stem from the Laws we make each other abide by?

In their written series of civilization, Will and Ariel Durant made the point in the first book, ""Our Oriental Heritage"", that man did not need or make laws until he thought his neighbor needed them.

Think on that a bit as you ponder your own question.

In my own personal opinion, I do believe that faith can and should inform public policy.  In a republic such as ours, we have agreed to abide by the majority, until a new majority comes into being.  And each new majority will bring its' own set of values.",,,Should religion be involved in our human rights?:,4
14,"First of all, very first of all, us people are very greedy. We like to scrimp if we can, so we can pocket the difference. $8B, according to Forbes is its budget. If it was so useless, or even if Congress felt they could get away without it, they would immediately remove it. $8B more! They'd raise their pay! But they don't. Why wouldn't they? Because they think it serves some sort of purpose, and I am assuming it is the one of protecting the USA. Secondly, it is evolving. You have seen new security measures every year and while yes, they are annoying, they may have potentially saved your life. How's that for throwing away 500ml of water and standing in queue for 30min?
I can see that many people in reddit disagree with this, however, and I want to know why, so I can form a balanced opinion. So CMV!",,,Cmv: i think the tsa is useful in the modern day.:,5
15,"Yes, it WILL recover - PROVIDED the government stops its meddling and 'bailing out' measures. It's things exactly like this that turned the potentially temporary market drop into a huge and horrid 'Great Depression'......and as part of the 'measures' then instituted were some of the Union Laws which are STILL crippling our ability to be competitive....
I wish lawmakers HAD TO take at least SOME relevant history while in high school...",,,"Will the economy recover shortly?   stance: yes, it will recover quickly (months):",1
16,"I don't know where you live, but here in SoCal we have pizza delivery services availabe until 3am, plus i'd rather go to Del Taco anytime over Taco Smell or Taco Hell aka Taco Bell.
Back in the 60s before Taco Fell became part of another multi-national corporation they were good, in our high school days we go there to cure the munchies, tacos were 5 for a buck back then.
JJ",,,Which is a better pizza or taco bell   stance: pizza:,2
17,"Since this place is close to where i live and it showed good yelp ratings i figured i would give it a try.  Went to try the veal sandwich and check out their baked goods. 
Veal sandwich - 2.5 stars. The veal wasn't tender enough which made it difficult to bite through. I added provolone and onions which was decent, but the onions were sliced pretty big. The tomato sauce was liquidy which makes me think there isn't enough tomato paste. This made the sandwich more soggy than tasty. 
Baked goods - 2 stars. I can't comment on the taste since i just checked it out but a handful of the items looked familiar from other bakeries which makes me think that they don't bake onsite. Also there was a lot of condensation build up in one of the cake/cookie fridge which make the food look unappetizing. The only things that looked worth trying was the lemon meringue and the cannolis.
Final thoughts - was hoping for way better but got less than mediocre. Won't be trying out again.",,,"Business review: 2.0 stars
business name: agincourt bakery. city: scarborough. categories: event planning & services, delis, caterers, italian, bakeries, food, restaurants:",3
18,"i love firefox and defended it, but what is odd is that this site is breaking in it.",,,Firefox vs internet explorer:,4
19,"Are you a Christian...or anything? If not, than hey who's to stop you! For the record, yeah it's wrong. Unfortunately, it's impossible to argue that, if you and the opposing individual refuse to share the same beliefs. Hence, my first point.",,,Is porn wrong:,5
20,I support pro choice if nothing else because it is one of the last bastions that free people hold out against the government for.,,,Pro choice vs pro life:,1
21,"Just a note to the creationists. Please use the ""Convinced me"" link correctly.
You're supposed to click this if the person's argument convinced you that Creationism is true. Some of you seem to be clicking anything and everything on the right hand side.
This will not help you win the debate by the way.",,,Evolution vs creation:,2
22,"Whoever said porn degrades women is idiotic. #1 They get compensated well, #2 they CHOSE to do it, #3 some girls actually like what they do, #4 without sex and porn, you may not have been born. Sex = life. =)",,,Is porn wrong:,3
23,one reason is just because so many more people agree with this side now,,,Gay marriage right or wrong:,4
24,"This debate has clarified for me that the government shouldn't really be in the marriage business.  Let the churches perform marriages for whomever they think fit, and let the government simply record the marraiges or civil unions and grant equal rights to them all.  As for plural ""marriages,""  they exist, but there is not a sizable part of the population which supports them.  That is a different debate for another day, and the issues are quite different.  In my mind, the purpose of marriage or civil union is to provide support to individuals, especially when they are raising children.  Some of the most monogamous couples I know are gay, and they are some of the best parents too.",,,Should same sex marriages be legal?:,5
25,"I had the oppertunity to visit Dar just a couple of weeks back.  And to answer each of your questions separately may be difficult for me.  But maybe my observations while I was in Dar may help you find some answers to your questions.

First and foremost, what I felt is that there is general feeling of detachment in the general public.  There is hardly any enthusiasm in whatever they are doing and have a tendency to just follow, whatever they are told.  There is great amount od tired, laid back approach to work and things can take forever to acomplish.

I am sure Tz as a country has lot of potential, but if you ask me my opinion as an outsider if Tz can develop into an exemplary country, my response would Yes, but there is long way to go and a lot to change before that.",,,Any ultra highly intelligent people who understand tanzania land issues and possible future outcomes?:,1
26,"I often ask myself the same question. 

The sheep stand behind him because this administration has done a successful job in terrorizing his (Bush's) supporters with fear. They use the crayola chart to let people know the 'terror threat' yet they want people to live their lives and not let what happened on 9/11 to affect how we live. The crayola chart really is only needed by state and local governments as it advises if they need more resources for that particular time frame. (public servants)

In the name of ' I don't like that party ', people will side with him as well. So Bush could have told people that he is the spawn of Satan and people would have still voted for him becuase they so much dislike the opposing political party.",,,Why do people still stand behind gw?:,2
27,"HAHAHA! It's not going to happen.

People are free to make there own decisions in life. Yeah, maybe it sucks that there is such big consequences to it, but really you sound stupid! Sex should not be taught as an evil thing. It's not evil or dirty.  Maybe you should teach your kids about responsiblity and learn to talk to them about it. Jails are over crowded now. Imagine what it would be like if ppl are thrown into jail because of that. You can't stop nobody from doing what they want to do. You should know that already from when you where younger. The more you discouage it the more they are going to want to do it. People have that right. Yes, even kids. That's the only way they learn.",,,Why not ban teenage sexuality altogether?:,3
28,"Well I think ultimately its just going to be a gimmick, why would the large supermarkets want to pay more for coffee beans etc when they don't have the decency to pay farmers in this country a fair price for their goods, and when we are all brainwashed on the money making ""carbon footprint"" idea how do you justify flying food round the world just to help the poor.

I don't think that the social elite will go without fair trade or organic even though its riddled with GM, due to snobbery.",,,Is fair trade real or just a gimmick to further differentiate products in saturated markets?:,4
29,"The establishment of Israel is often cited as necessary based on the need to protect people of Jewish heritage from around the world. To the victors go the spoils. Why should an Israeli state be established in a historically relevant but highly dangerous location because of an historical claim that is thousands of years old? Why not annex a portion of Germany, relocate a population whose government actively worked to destroy the Jews, and work towards acceptance of Jewish visitors in their Holy Land? I am very aware that not all Germans were complicit in the actions of the Nazis. However, the annexation of a portion of Germany is arguably more morally justifiable than basically conquering Palestine because of a religion-based claim. If Jewish security is the issue, lopping off a portion of Germany to form Neo-Israel would have been the vastly superior option. CMV.",,,Cmv: israel should have been established within the borders of germany as an independent state following the second world war.:,5
30,"Coors light tastes like beer-flavored piss-water. Labatts tastes like a pond that 80-year-old canucks had sex in. Budweiser is for retards who don't know what beer is. 

But Yuengling is mass produced and... actually pretty good. 

It's not the *best* beer, mind you. It's *good*, but it's not like, king of beers or anything. 

Craft brews are getting a lot of attention in recent years, especially in America, and a lot of beer snobs go to parties. 

These guys are not easy to please, but they *will* settle for Yuengling. It's just good enough to not offend, and just shitty enough to please the unwashed plebs. 

Change my view.",,,Cmv: i think yuengling is the best beer to get if you are having a party and don't know what beers people like.:,1
31,"Anything intelligence created by a more intelligent being is artificial correct? The creating being is the ""real"" being, while it's creation is an imitation of itself. That means if anything we create is artificial, we ourselves are artificial intelligence.....if we were created. If we have rights and need to respect one another, does that mean we should have love and compassion for our creations? Would it be possible to love something we have given artificial intelligence? If not, how can god love me or you?",,,"If humans were created, are we technically artificial intelligence?   stance: yes.:",2
32,"""Nothing exists."" To utter that sentence - or even contemplate it - applies existence to something that is ""nothing."" Yet to argue that nothing exists asserts - paradoxically - that in fact, no thing exists. It is a logical impossibility to argue that nothing does not exist. Therefore, we must apply existence to nothing - making nothing something indeed!",,,Nothing exists   stance: nothing exists:,3
33,"Uh, lemme see, at 82 years old, especially in the 40's, it may have been by natural causes. I think if the government wanted him dead, they would have offed him WAY before when he was actually inventing things which could possibly be related to weapons. Now Michael Jackson or Elvis Presley... Those would be much more conspiracy theory probabilities.. lol...",,,What killed nikola tesla   stance: natural causes:,4
34,"As we know that India is fully filled with corruption. Each and every person have no time to help others, his only aim is to earn money in any way.Our manners and civilization are reducing and reducing every day.",,,India has the potential to lead the world:,5
35,"That's your best argument - ""Because they don't"" ?
I thought there was a reason for everything...
I don't see the squirrel outside my window evolving. In fact, I'm pretty sure squirrels have looked and acted the same for thousands of years.
How does an animal aquire a trait that he wasn't born with? Does he just wish for it really hard and it magically grows?
And you proved my point - ""species have certain characteristics and properties""
I noticed you didn't mention that their characteristics randomly change
And by the way, I'm just wondering because I'm a curious person...
what insects are you talking about?",,,Evolution vs creation:,1
36,"Yes! and yes and yes and definately a god damn bloody yes.
Lack of physical education is the reason why your aunt or uncle is in hospital.
Lack of physical education is the reason why millions of people are fat.
Lack of physical education is the reason why you cannot sleep properly at times.
Lack of physical education is the reason why you are not having super great sex with your girlfriend(s)",,,Should physical education be mandatory in schools:,2
37,its just unnatural because all sexual creatures mate with the opposite sex.,,,Gay marriage right or wrong:,3
38,"this is my big problem with christianity: why is it about belief. there have been horrible people who are believers. what about wonderful people who do great things for the world and are atheists. is it fair to punish them for not knowing what the nature od reality is??? I AM an atheist and im a good person. the idea that a mere belief difference can seal ones fate is beyond preposterous, its madness!!",,,Christianity or atheism:,4
39,"Gay Marriage. I'm an agnostic so in no way does my religion conflict with this matter. I'm an avid gay rights supporter. Marriage, is said to be the marriage of 2 people who love and care about each other. Some Straight couples just get married for the benefit of getting kids. So is that right in any case? What is the purpose of marriage if 2 people only get married to reap its benefits? I.e Have kids? As we are living in a developing society, more and more and more people are coming to terms and agreeing that gay marriage is ok.",,,Gay marriage right or wrong:,5
40,"It sounds to me like you have big trouble. CASA - that's Community Alternate Systems Agency - is staffed with Registered Nurses and makes determinations about Medicaid eligibility. 

If you took your child to a doctor or an ER and someone saw what they took for signs of abuse (bruises, etc.) they are bound by law to make a report. 

If it has nothing to do with that, they may just be trying to determine if you qualify for Medicade.  Being bureaucrats, they have a tendency to stick their noses into everyone's business.",,,How do you feel about dfhs and casa involving your family?:,1
41,"First of all, the Constitution does NOT guarantee the ""pursuit (or persuit) of happiness"".  That expression appears in the preamble to the Declaration of Independence.  On substance, I doubt very much time and energy is spent in enforcing laws relating to prostitution in relation to other offenses. Finally, will you admit to any role for morality in criminal law?  I mean, take laws relating to age of consent -- why is consensual sex illegal for, say, 15 year olds but not 16 year olds?  In other words, how do you draw a line?",,,Why does the government have the right to enact 'morals' laws?:,2
42,"It's still considered a ""right-of-way"" violation. The driver with the legal ""right-of-way"" is the one with the green light, whether he's an idiot or not. Up here in New England (and I'm sure everywhere else), we have a lot of drivers that go for miles with their blinker on. I wait until they have actually started making the turn to go, because once they start turning, they lose the ""right-of-way"" on the street they were on.",,,If there is an accident at a stop light because one driver makes a right turn against the light and the other?:,3
43,"Doc, be very careful with this. I'm a writer and an ex police officer. These people will have you surgically removing their boots from your own...Send an official certified letter to the actual original publisher of the material along with a permission form to use their content. And, if they don't get back to you, extract the info from another source. Protect yourself my friend. Their lawyers will eat your lunch and not even leave you a Twinkie! Also, a disclaimer on your site is still a good idea. Tina",,,Where can i find some lawyer's free consultation online especially on the matter of copyrights and trademark?:,4
44,"Because they haven't thought through it properly. Just like the rest of us (including, no doubt, you), many of their opinions are a mix of other peoples opinions. The result is an inconsistent view (also note opinions on the death penalty). It is almost impossible to think through EVERY issue for yourself because there are so many.

In many cases it could be conservatism is masquarading as pro-life. They are not the same thing. Conservatism says whatever we used to do is right. Pro-life says that every human life is worth more than anything.

On the other hand, pro-choice could be called inconsistent. Just as an a parent may believe their life would be better if the foetus didn't exist, the U.S. may feel it more convenient if the nation of Iraq is a bloody mess.

Every unheard voice of every oppressed person, whether in Iraq or in the womb, is worth defending.",,,Hypocrites?:,5
45,"Instruments have such wild limitations compared To a normal composition programs that I think they're obsolete in the modern musical world. They have imperfection, and you cant control the frequencies of the sounds you're making as well. People will spend years learning how to make a single sound, instead of all possible sounds. When you play an instrument, you're just a drone, an atomaton playing someone else's piece. It's like being a soldier vs being the president. Sure, it takes a lot of work, but it's a waste of talent.",,,Cmv: instruments are stupid and obsolete:,1
46,"This is influenced by the IAmA submission from the guy who proudly kills fellow human beings in the name of ""saving"" wildlife. But really? How are poachers more morally and ecologically irresponsible than hunters? Hunters have been responsible for the extinction of wildlife in recent memory and in past events of human existence. Hunters, just like poachers, threaten animal for the sake of profit. Anti pouching initiative is hypocrisy in itself. One, it does not make the existence of mankind better. Two, it doesn't stop the extinction of various species in wildlife at the hands of human beings.",,,"Cmv: poaching and hunting are the same thing, and hunting is no more ecologically friendly than poaching:",2
47,"This is a no brainer, coffee has no medical benefits, keep in mind that being a stimulant and tasting good is not a medical benefit. On the other hand going back over 5,000 years marihuana's active ingredient THC has been used fro many health beneifits, moroever the stalk, leaves and seeds have been used to manufacture rope, canvas, clothings and other materials as well.... No Contest! Marijuana places high above coffee",,,Marijuana v.s. coffee (healthier?)   stance: marijuana has more medical benefits:,3
48,"Was very disappointed with this place.  Been going to a ramen place down the street for a while and always leave full and happy.... 

came here after hearing all the hype about pho and wasnt happy.  i totally would pick ramen over pho any day!!!!

the egg rolls were very good and that was the only good thing about the dinner!",,,"Business review: 1.0 stars
business name: pho mailan. city: henderson. categories: vietnamese, food, restaurants:",4
49,"Anyone who says Firefox 2 has major memory leaks obviously hasn't actually used Firefox 2. The only memory issues I've come across is on opening multiple windows (20 or more at once) or when leaving Firefox active for three hours or more at a time (A known issue, which a simple restart will fix).
And arguing for IE7 in favor of Firefox... Weakness. For every feature they added to IE 7 they removed one of the advantages earlier versions had. (Flexible toolbars? Customizable buttons? Who needs em!)",,,Firefox vs internet explorer:,5
50,Have any of you noticed that those who are against books are the ones who have terrible arguments. Like that person who just said TV is awesome with many exclamation marks and in capitals. That clearly proves that books are much better than TV because it TV rots the brain.,,,Tv is better than books:,1
51,"The scientific rigor you mention is not present in evolutionary theory. Here's one example: In the 1800s, Charles Lyell and others came up with dates for the rock strata. Radiometric dating wasn't invented until the 1900s. When it was invented, the techniques were calibrated to match the dates Lyell came up with. To say that this proves the dates that Lyell came up with is a logical fallacy, and it sure doesn't sound like true scientific rigor to me.",,,Evolution vs creation:,2
52,Could a unproven higher power have created a perfect world that appeared to have existed for more than 10 million years when really it is only 1 hundred thousand years old?,,,Evolution vs creation:,3
53,yes! our kids are so out of shape for the most part and eat too much junk,,,Should physical education be mandatory in schools:,4
